{
  "goal_id": "goal-1",
  "role": "bears-development-workflow-orchestrator",
  "repo_boundary": "BearsCLOUD/bears-codex-workflow-plugin",
  "allowed_write_scope": [
    "scripts/development_workflow_validate.py"
  ],
  "forbidden_scope": [
    "runtime",
    "secrets"
  ],
  "validation_commands": [
    "python3 scripts/development_workflow_validate.py validate"
  ],
  "restricted_data_taint": "none",
  "status": "pass",
  "branch_worktree_policy": "clean worktree",
  "local_agents_file": "AGENTS.md",
  "closeout_format": "status packet",
  "owner_role": "bears-development-workflow-orchestrator",
  "reviewer_role": "bears-platform-security-reviewer",
  "rollback_path": "revert PR"
}
